{
  "schema_version": "0.1.0",
  "project": {
    "name": "Adria Karting Raceway",
    "created_at": "2026-08-10T00:00:00.000Z",
    "updated_at": "2026-08-10T00:00:00.000Z"
  },
  "track": {
    "coordinate_system": "local_cartesian_m",
    "direction": "clockwise",
    "width_m": 8.0,
    "raw_centerline": [
      [
        -73.74,
        45.89
      ],
      [
        -71.5,
        56.7
      ],
      [
        -69.25,
        67.51
      ],
      [
        -67.01,
        78.32
      ],
      [
        -64.76,
        89.13
      ],
      [
        -62.13,
        99.84
      ],
      [
        -57.68,
        109.85
      ],
      [
        -50.77,
        118.32
      ],
      [
        -41.06,
        123.49
      ],
      [
        -30.29,
        125.77
      ],
      [
        -19.3,
        125.37
      ],
      [
        -8.42,
        123.48
      ],
      [
        2.34,
        121.0
      ],
      [
        13.08,
        118.42
      ],
      [
        23.82,
        115.84
      ],
      [
        34.55,
        113.27
      ],
      [
        45.29,
        110.69
      ],
      [
        56.03,
        108.11
      ],
      [
        66.45,
        104.58
      ],
      [
        76.2,
        99.58
      ],
      [
        84.57,
        92.42
      ],
      [
        90.19,
        82.92
      ],
      [
        92.92,
        72.26
      ],
      [
        92.46,
        61.29
      ],
      [
        88.62,
        51.05
      ],
      [
        79.78,
        44.97
      ],
      [
        68.91,
        43.57
      ],
      [
        58.2,
        45.79
      ],
      [
        49.51,
        52.41
      ],
      [
        42.44,
        60.9
      ],
      [
        35.14,
        69.18
      ],
      [
        27.49,
        77.14
      ],
      [
        19.51,
        84.73
      ],
      [
        9.76,
        89.53
      ],
      [
        -1.15,
        91.04
      ],
      [
        -12.17,
        90.74
      ],
      [
        -22.79,
        88.19
      ],
      [
        -28.3,
        79.04
      ],
      [
        -27.64,
        68.06
      ],
      [
        -26.46,
        57.18
      ],
      [
        -30.75,
        47.14
      ],
      [
        -36.28,
        37.58
      ],
      [
        -41.63,
        27.92
      ],
      [
        -46.55,
        18.03
      ],
      [
        -51.35,
        8.09
      ],
      [
        -55.9,
        -1.97
      ],
      [
        -60.45,
        -12.03
      ],
      [
        -64.6,
        -22.25
      ],
      [
        -65.93,
        -33.09
      ],
      [
        -61.4,
        -42.65
      ],
      [
        -51.18,
        -42.65
      ],
      [
        -43.01,
        -35.53
      ],
      [
        -37.12,
        -26.21
      ],
      [
        -32.18,
        -16.33
      ],
      [
        -28.11,
        -6.09
      ],
      [
        -24.42,
        4.32
      ],
      [
        -20.91,
        14.79
      ],
      [
        -17.56,
        25.31
      ],
      [
        -13.12,
        35.4
      ],
      [
        -5.48,
        43.02
      ],
      [
        4.84,
        46.47
      ],
      [
        15.37,
        43.87
      ],
      [
        24.46,
        37.65
      ],
      [
        32.13,
        29.72
      ],
      [
        39.58,
        21.56
      ],
      [
        46.5,
        12.99
      ],
      [
        52.56,
        3.76
      ],
      [
        57.54,
        -6.08
      ],
      [
        62.33,
        -16.03
      ],
      [
        65.79,
        -26.52
      ],
      [
        67.21,
        -37.31
      ],
      [
        61.45,
        -46.19
      ],
      [
        50.81,
        -47.19
      ],
      [
        40.89,
        -42.66
      ],
      [
        34.3,
        -34.06
      ],
      [
        30.71,
        -23.66
      ],
      [
        27.65,
        -13.05
      ],
      [
        21.89,
        -4.25
      ],
      [
        11.85,
        -6.26
      ],
      [
        7.15,
        -16.19
      ],
      [
        3.3,
        -26.54
      ],
      [
        -0.56,
        -36.89
      ],
      [
        -3.95,
        -47.35
      ],
      [
        -3.43,
        -58.18
      ],
      [
        4.78,
        -65.3
      ],
      [
        14.9,
        -69.68
      ],
      [
        25.11,
        -73.88
      ],
      [
        35.32,
        -78.08
      ],
      [
        44.93,
        -83.42
      ],
      [
        49.24,
        -93.15
      ],
      [
        43.78,
        -101.9
      ],
      [
        32.85,
        -102.07
      ],
      [
        22.0,
        -100.04
      ],
      [
        11.21,
        -97.73
      ],
      [
        0.78,
        -94.1
      ],
      [
        -9.06,
        -89.19
      ],
      [
        -18.35,
        -83.25
      ],
      [
        -27.58,
        -77.4
      ],
      [
        -38.42,
        -75.69
      ],
      [
        -48.53,
        -79.42
      ],
      [
        -57.92,
        -85.12
      ],
      [
        -68.48,
        -88.0
      ],
      [
        -79.26,
        -87.1
      ],
      [
        -89.21,
        -82.47
      ],
      [
        -94.72,
        -73.12
      ],
      [
        -95.73,
        -62.31
      ],
      [
        -94.02,
        -51.41
      ],
      [
        -91.93,
        -40.57
      ],
      [
        -89.65,
        -29.76
      ],
      [
        -87.38,
        -18.95
      ],
      [
        -85.11,
        -8.15
      ],
      [
        -82.84,
        2.66
      ],
      [
        -80.56,
        13.47
      ],
      [
        -78.29,
        24.27
      ],
      [
        -76.02,
        35.08
      ]
    ]
  },
  "kart": {
    "model": "point_mass_v1",
    "total_mass_kg": 190,
    "parameters": {
      "power_hp": 13,
      "kart_mass_kg": 115,
      "driver_mass_kg": 75,
      "top_speed_kph": 82,
      "grip_coefficient": 1.05,
      "brake_decel_mps2": 7.5
    }
  },
  "simulation": {
    "solver": "speed_profile_v1",
    "settings": {
      "sample_count": 200
    },
    "safety_margin_m": 0.55
  }
}
